prod_id,prod_name,category,subcategory,color,size,weight,quantity,sold,price,currency,price_discount,rating_count,avg_rating,location,artisan_name,description
84,Marble Cup,Marble,Drinkware,Marble,10*5 cm,0.55,29,1,195,EGP,183,76,4.63,Aswan,Heba Soliman,"This small marble cup, carved from high-quality marble, offers a minimalist design with natural elegance. Its refined texture and sturdy construction make it a timeless collectible."
85,Rectangular Marble Serving Plate,Marble,Tableware,Marble,22 cm,1.64,49,2,530,EGP,484,16,4.89,Giza,Fatima Hassan,"Made from premium marble, this rectangular serving plate combines functionality with classic design. Its smooth finish and durable material make it a perfect addition to any dining setting."
86,Ribbed Alabaster Marble bonbonniere,Marble,Tableware,Marble,12*19 cm,0.88,45,55,630,EGP,487,90,4.97,Giza,Fatima Hassan,"This bonbonniere is crafted from ribbed alabaster marble, featuring intricate textures and refined detailing. Its unique design and durable finish offer a stylish touch to any decor."
87,White Alabaster Marble sugar bowl,Marble,Tableware,Marble & White,12 cm,1.36,33,80,310,EGP,246,90,4.51,Alexandria,Ahmed Ali,"Handcrafted from white alabaster marble, this sugar bowl boasts a clean and elegant design with subtle natural textures. Its timeless style makes it a charming table accent."
88,Beige Alabaster Marble vase,Marble,Home Decor,Marble & Beige,25 cm,1.67,19,58,630,EGP,575,48,3.75,Luxor,Nour Khaled,"This exquisite vase, made from beige alabaster marble, showcases a soft, natural palette with refined detailing. Its elegant design and durable material offer a versatile decorative accent."
89,Beige Alabaster Marble vase Tutankhamun,Marble,Home Decor,Marble & Beige,20 cm,1.63,49,1,310,EGP,241,85,3.17,Giza,Fatima Hassan,"Featuring a Tutankhamun-inspired design, this vase is crafted from beige alabaster marble with intricate detailing. Its unique blend of history and art makes it a captivating piece."
90,Alabaster Marble obelisk,Marble,Home Decor,Marble & Beige,20 cm,0.77,5,1,135,EGP,100,39,4.55,Giza,Fatima Hassan,"This small obelisk, crafted from alabaster marble in a beige tone, features a sleek and minimalist design. Its classic material and refined finish make it a subtle yet striking."
91,Pottery Mug,Ceramics & Pottery,Drinkware,Blue,One Size,0.39,29,91,325,EGP,272,33,4.12,Luxor,Nour Khaled,"Handcrafted from high-quality ceramics, this blue pottery mug features a vibrant finish and durable design. Its artistic detailing makes it perfect for everyday use."
92,Pottery Mug,Ceramics & Pottery,Drinkware,White,One Size,0.43,11,53,325,EGP,303,94,3.85,Luxor,Mariam Said,"This classic white pottery mug is crafted from fine ceramics and offers a clean, timeless design. Its sturdy build and elegant finish make it ideal for daily enjoyment."
93,Pottery Mug,Ceramics & Pottery,Drinkware,Black,One Size,0.54,13,86,325,EGP,284,23,4.81,Alexandria,Samir Fathy,"Made from quality ceramics, this black pottery mug features a sleek design with a modern twist. Its durable material and minimalist style make it a versatile addition to any kitchen."
94,Pottery Bowl,Ceramics & Pottery,Tableware,Blue & Green,One Size,1.42,28,95,150,EGP,126,10,3.22,Luxor,Mariam Said,"Crafted from fine ceramics, this bowl features a delightful blend of blue and green hues. Its unique design and durable construction add charm to any table setting."
95,Pottery Bowl,Ceramics & Pottery,Tableware,Black,One Size,1.61,5,96,150,EGP,1108,69,3.99,Giza,Fatima Hassan,"This sleek pottery bowl, made from high-quality ceramics in black, offers a modern and minimalist design. Its refined finish and durability make it perfect for everyday dining."
96,Pottery Bowl,Ceramics & Pottery,Tableware,Brown,One Size,0.91,48,0,150,EGP,128,34,3.02,Giza,Fatima Hassan,"Crafted from quality ceramics, this brown pottery bowl boasts a warm, earthy finish and simple design. Its durable construction and artisanal charm make it inviting for any meal."
97,Pottery Plate,Ceramics & Pottery,Tableware,Black,One Size,1.44,12,18,150,EGP,142,52,3.94,Cairo,Laila Nasser,"This elegant pottery plate, made from fine ceramics in black, features a clean, contemporary design. Its durable material and minimalist style make it a versatile piece for serving or display."
98,Pottery Frying Pan,Ceramics & Pottery,Cooking,Reddish Brown,One Size,2.19,28,1,325,EGP,238,95,3.11,Aswan,Heba Soliman,"Crafted from high-quality ceramics, this reddish brown frying pan combines functionality with an artisanal finish. Its durable design and unique color add a touch of style to your kitchen essentials."
99,Pottery Ashtray,Ceramics & Pottery,Home Decor,Blue & Gold,One Size,2.04,15,52,150,EGP,124,10,3.24,Aswan,Mostafa Ibrahim,"This artistic pottery ashtray, featuring a blend of blue and gold hues, is handcrafted from quality ceramics. Its unique design and vibrant finish make it a distinctive accessory."
100,Pottery Ashtray,Ceramics & Pottery,Home Decor,Blue,One Size,1.75,21,43,130,EGP,119,19,3.24,Luxor,Mariam Said,"Made from fine ceramics, this blue pottery ashtray offers a sleek design with a smooth finish. Its compact size and artistic flair make it both functional and decorative."
101,Ceramic Mug,Ceramics & Pottery,Drinkware,Blue & White,One Size,0.47,12,89,195,EGP,172,58,4.3,Giza,Fatima Hassan,"This ceramic mug, featuring a classic blue and white design, is crafted from quality ceramics for everyday use. Its timeless style and durable finish make it a staple piece."
102,Ceramic Plate,Ceramics & Pottery,Tableware,Brown,One Size,1.32,39,31,550,EGP,480,96,4.49,Cairo,Laila Nasser,"Handcrafted from high-quality ceramics, this brown ceramic plate offers a rich, earthy tone with a refined finish. Its elegant design and durable material make it a statement piece for any table."
103,Ceramic Bowl,Ceramics & Pottery,Tableware,Green,One Size,1.25,39,69,245,EGP,214,1,4.17,Luxor,Mariam Said,"Crafted from fine ceramics, this green bowl features a fresh, vibrant design with a smooth finish. Its versatile style and durable construction make it ideal for serving or display."
104,Ceramic Coaster,Ceramics & Pottery,Home Decor,Multicolor,One Size,0.44,37,31,55,EGP,43,69,4.92,Aswan,Mostafa Ibrahim,This handcrafted ceramic coaster features a lively multicolor design that adds a playful touch to any table. Its durable ceramic build ensures both functionality and style.
105,Pottery Coaster,Ceramics & Pottery,Home Decor,Multicolor,One Size,0.76,9,67,55,EGP,42,4,3.75,Cairo,Omar El-Sayed,"Featuring a vibrant multicolor pattern, this pottery coaster is crafted from quality ceramics for everyday use. Its playful design and sturdy construction help protect your surfaces in style."
106,Ceramic Vase,Ceramics & Pottery,Home Decor,Blue,One Size,1.71,46,54,360,EGP,324,16,3.57,Luxor,Mariam Said,"This elegant ceramic vase, adorned in a soothing blue finish, is handcrafted from high-quality ceramics. Its timeless design and durable material make it a perfect accent piece."
107,Pottery Cup,Ceramics & Pottery,Drinkware,Brown,One Size,0.31,43,74,150,EGP,135,24,4.74,Luxor,Mariam Said,"Made from fine ceramics, this brown pottery cup features a rustic design with a smooth finish. Its durable construction and earthy tone make it a charming addition to any kitchen."
108,3D Tableau Tut-Ankh-Amoon,Wood,Home Decor,Wood,50*40 cm,2.35,45,55,975,EGP,893,80,3.45,Giza,Fatima Hassan,"Expertly crafted from quality wood, this 3D tableau features the iconic Tut-Ankh-Amoon design with intricate details. Its dimensional artistry and durable construction make it a captivating decorative piece."
109,3D Tableau pharaonic statue,Wood,Home Decor,Wood,34*24 cm,2.68,32,16,535,EGP,496,2,4.93,Luxor,Mariam Said,"Carved from fine wood, this 3D tableau showcases a pharaonic statue with detailed craftsmanship. Its rich texture and classic design capture the essence of ancient artistry."
110,3D Tableau Nefertiti,Wood,Home Decor,Wood,34*24 cm,2.06,11,37,535,EGP,442,92,3.02,Alexandria,Ahmed Ali,"Crafted from quality wood, this 3D tableau features a stunning depiction of Nefertiti with intricate detailing. Its timeless design and artisan craftsmanship make it a standout piece."
111,Wooden Tissue holder,Wood,Home Decor,Wood,One Size,0.95,13,23,155,EGP,127,32,4.94,Alexandria,Samir Fathy,"This wooden tissue holder is crafted from quality wood and offers a sleek, minimalist design. Its functional form and natural finish add a charming touch to any space."
112,Wooden Tea Box,Wood,Home Decor,Wood,One Size,0.58,12,68,260,EGP,233,91,3.09,Giza,Khaled Mostafa,"Handcrafted from fine wood, this tea box features a traditional design with a natural finish. Its sturdy construction and elegant detailing make it a perfect keepsake for tea lovers."
113,Wooden Rolling pin,Wood,Home Decor,Wood,One Size,2.86,16,97,155,EGP,133,84,4.78,Luxor,Mariam Said,"Crafted from high-quality wood, this wooden rolling pin offers a classic design with a smooth finish. Its durable material and timeless craftsmanship make it an essential kitchen tool."
114,Wooden Shoehorn,Wood,Home Decor,Wood,One Size,0.73,38,69,65,EGP,56,24,4.06,Luxor,Mariam Said,"This wooden shoehorn is made from quality wood, providing a sturdy and elegant tool for everyday use. Its minimalist design and natural finish ensure both functionality and style."
115,Wooden Tray,Wood,Home Decor,Wood,35*23 cm,1.06,37,85,1335,EGP,1200,12,4.99,Luxor,Mariam Said,"Handcrafted from premium wood, this tray features a refined design with ample space for serving. Its durable construction and natural finish make it a versatile accessory."
116,Wooden Box,Wood,Home Decor,Wood,13*18 cm,0.81,27,10,965,EGP,890,50,3.15,Cairo,Omar El-Sayed,"This intricately crafted wooden box, made from quality wood, offers a compact design with detailed workmanship. Its elegant finish and durable material make it perfect for storing small treasures."
117,Wooden Coaster,Wood,Home Decor,Wood,9.4*9.4 cm,0.56,28,15,205,EGP,160,35,4.11,Giza,Khaled Mostafa,"Crafted from quality wood, this wooden coaster features a simple yet elegant design. Its durable material and natural finish make it a perfect addition to any home decor."
